{
  "schema_version": 2,
  "fact_snapshot_id": "fact_snapshot_7c19e04928e8cc09",
  "app_id": "zhiyu_ai_hk",
  "confirmed_at": "2026-08-07T12:53:11Z",
  "inputs_hash": "c0056b7840bfa9281918e9be039a0aa64df2769687ecc0a7626bffe3d9863e5a",
  "facts_hash": "ce99bcda5ea7c0b2dd10d3db40b7937576d45e57e0cd34d5967ae21aa2ac18b6",
  "source_index": {
    "app_id": "zhiyu_ai_hk",
    "generated_at": "2026-08-07T12:52:27Z",
    "inputs_hash": "c0056b7840bfa9281918e9be039a0aa64df2769687ecc0a7626bffe3d9863e5a",
    "sources": [
      {
        "source_id": "src_d551639e51e9f42c",
        "scope": "input",
        "path": "inputs/README-素材说明.md",
        "name": "README-素材说明.md",
        "kind": "other",
        "hash": "2d30c7e27baedfda976d2c1f07bc34691b5aea1a76f53263fab2333c6a68a5f3",
        "size": 575,
        "parse_status": "discovered",
        "ignored": false,
        "ignored_reason": null
      },
      {
        "source_id": "src_77831e6da63adc0f",
        "scope": "input",
        "path": "inputs/产品截图/知鱼命理AI/IMG_6020.PNG",
        "name": "IMG_6020.PNG",
        "kind": "product_image",
        "hash": "672d6e1b5e869248705168d459b8a193fd42c33284a637d9eca52ce73223b233",
        "size": 723383,
        "parse_status": "indexed_only",
        "ignored": false,
        "ignored_reason": null
      },
      {
        "source_id": "src_96efa43690f36076",
        "scope": "input",
        "path": "inputs/产品截图/知鱼命理AI/IMG_6021.PNG",
        "name": "IMG_6021.PNG",
        "kind": "product_image",
        "hash": "853aaf3c4171e913c360f10a6e0c3687f0fb8bae9090ba52bd51c2a05fe296d4",
        "size": 540687,
        "parse_status": "indexed_only",
        "ignored": false,
        "ignored_reason": null
      },
      {
        "source_id": "src_dd5a95c114de5aa7",
        "scope": "input",
        "path": "inputs/产品截图/知鱼命理AI/IMG_6032.PNG",
        "name": "IMG_6032.PNG",
        "kind": "product_image",
        "hash": "ff2f0ffb12d28a36f47469088b50a5ef79fbf741fc2aba69018ef2b14f145cc6",
        "size": 543390,
        "parse_status": "indexed_only",
        "ignored": false,
        "ignored_reason": null
      },
      {
        "source_id": "src_ec7db96455211cc0",
        "scope": "input",
        "path": "inputs/产品截图/知鱼命理AI/IMG_6033.PNG",
        "name": "IMG_6033.PNG",
        "kind": "product_image",
        "hash": "339724a60294ea9c38a7d18eb468e40eed712a693d3c7cbf0acae8a993e2c5a3",
        "size": 613994,
        "parse_status": "indexed_only",
        "ignored": false,
        "ignored_reason": null
      },
      {
        "source_id": "src_9fe94618b81f4b57",
        "scope": "input",
        "path": "inputs/产品截图/知鱼命理AI/IMG_6034.PNG",
        "name": "IMG_6034.PNG",
        "kind": "product_image",
        "hash": "a28ea9190957a404444a54ad08b518dd908ae64e81832538d9e31270d6d2443e",
        "size": 727731,
        "parse_status": "indexed_only",
        "ignored": false,
        "ignored_reason": null
      },
      {
        "source_id": "src_9b3766ce4d539c23",
        "scope": "input",
        "path": "inputs/产品截图/知鱼命理AI/IMG_6035.PNG",
        "name": "IMG_6035.PNG",
        "kind": "product_image",
        "hash": "c86c83acf7bf6198f451c23a70ca03aa5546d9cc00f4bed13d04eeb71e8699fb",
        "size": 628392,
        "parse_status": "indexed_only",
        "ignored": false,
        "ignored_reason": null
      },
      {
        "source_id": "src_9922b43e13bea9b9",
        "scope": "input",
        "path": "inputs/产品截图/知鱼命理AI/image-6.png",
        "name": "image-6.png",
        "kind": "product_image",
        "hash": "f3ea73b1097e947fd46f1eeade85081caa0e76b0b9332400cc108ecc445440b9",
        "size": 102004,
        "parse_status": "indexed_only",
        "ignored": false,
        "ignored_reason": null
      },
      {
        "source_id": "src_676249117c39dc96",
        "scope": "input",
        "path": "inputs/产品截图/知鱼命理AI/image-7.png",
        "name": "image-7.png",
        "kind": "product_image",
        "hash": "184d305118178f9d98b3c02054879b38159d0d7b2f3d3fd4de31dc154b0e4644",
        "size": 191146,
        "parse_status": "indexed_only",
        "ignored": false,
        "ignored_reason": null
      },
      {
        "source_id": "src_b0b16d571776b3fe",
        "scope": "input",
        "path": "inputs/产品截图/知鱼命理AI/image-9.png",
        "name": "image-9.png",
        "kind": "product_image",
        "hash": "e9da8124c2e70944d43cb26b391380bc90bdb47a2ef827c42177de260ea042c6",
        "size": 186563,
        "parse_status": "indexed_only",
        "ignored": false,
        "ignored_reason": null
      },
      {
        "source_id": "src_7f05036a3e7755f3",
        "scope": "input",
        "path": "inputs/产品说明/zhiyu-product-description.md",
        "name": "zhiyu-product-description.md",
        "kind": "other",
        "hash": "6f161bd10b02f73272bd384de88f54ac05b0203ba56f32422d40d0d243616095",
        "size": 4653,
        "parse_status": "discovered",
        "ignored": false,
        "ignored_reason": null
      },
      {
        "source_id": "src_c4eb82aebc19354d",
        "scope": "input",
        "path": "inputs/产品说明/知鱼SEO-GEO方案.md",
        "name": "知鱼SEO-GEO方案.md",
        "kind": "other",
        "hash": "2054435b2fa61b8121dafb3c7e0f687d10c580db6a91479f19c185f2119a2bed",
        "size": 9657,
        "parse_status": "discovered",
        "ignored": false,
        "ignored_reason": null
      },
      {
        "source_id": "src_6f9260e39c982d6a",
        "scope": "input",
        "path": "inputs/产品说明/知鱼定价策略-内部参考.md",
        "name": "知鱼定价策略-内部参考.md",
        "kind": "other",
        "hash": "33acb9017c67d61a17f504560285272b5740759edcd09e852722a77629be66ed",
        "size": 3466,
        "parse_status": "discovered",
        "ignored": false,
        "ignored_reason": null
      },
      {
        "source_id": "src_8a64234e6eafe5c5",
        "scope": "input",
        "path": "inputs/写作参考/易学科普写作框架.md",
        "name": "易学科普写作框架.md",
        "kind": "other",
        "hash": "0a75b9e3edd58262c1b946ce550b103343d2d90f922c9c915a127dd7ea2789cd",
        "size": 6637,
        "parse_status": "discovered",
        "ignored": false,
        "ignored_reason": null
      },
      {
        "source_id": "src_0d175bb9419f10e5",
        "scope": "input",
        "path": "inputs/发布稿/《齐物论》有感.md",
        "name": "《齐物论》有感.md",
        "kind": "other",
        "hash": "09652b28dd1837ca6455fc5c543ff833bb07c83c0042ec1f3152cf3c9e6b9973",
        "size": 5142,
        "parse_status": "discovered",
        "ignored": false,
        "ignored_reason": null
      },
      {
        "source_id": "src_b4e84f52548d9d43",
        "scope": "input",
        "path": "inputs/发布稿/寅月，我跪下求了财.md",
        "name": "寅月，我跪下求了财.md",
        "kind": "other",
        "hash": "c2a755b15cee5c57f3e33e5d1491dd3575d99f967cd1b4653fc114cd1a78aef8",
        "size": 5857,
        "parse_status": "discovered",
        "ignored": false,
        "ignored_reason": null
      },
      {
        "source_id": "src_27b68989b7cea472",
        "scope": "input",
        "path": "inputs/发布稿/看完天道，有几句话一直在脑子里转.md",
        "name": "看完天道，有几句话一直在脑子里转.md",
        "kind": "other",
        "hash": "e0fa175bc28ba9ce553b46f91b3dee80ec7d99b7fa4b48baf7ce436f2b1cb4bd",
        "size": 9130,
        "parse_status": "discovered",
        "ignored": false,
        "ignored_reason": null
      },
      {
        "source_id": "src_a0fd71edc407560e",
        "scope": "input",
        "path": "inputs/发布稿/知鱼上线了——一个真的会先排盘再开口的命理 Agent.md",
        "name": "知鱼上线了——一个真的会先排盘再开口的命理 Agent.md",
        "kind": "other",
        "hash": "ef59c539cf6b3ea7ea49955e2e9860f631ffcff31a959192316d0026a08ecced",
        "size": 7501,
        "parse_status": "discovered",
        "ignored": false,
        "ignored_reason": null
      },
      {
        "source_id": "src_67190708323b09ed",
        "scope": "input",
        "path": "inputs/品牌资产/favicon.png",
        "name": "favicon.png",
        "kind": "company_asset",
        "hash": "03bc0c90f3b8670bb4034b988b64ef5c68f71092868d452f2e3668303dbec86a",
        "size": 8686,
        "parse_status": "indexed_only",
        "ignored": false,
        "ignored_reason": null
      },
      {
        "source_id": "src_1870a19e46a974cd",
        "scope": "input",
        "path": "inputs/品牌资产/logo_color_nobg.png",
        "name": "logo_color_nobg.png",
        "kind": "company_asset",
        "hash": "dce9be888321f0dedff97082d72e0acc96ed064ba165c13690ada3ba9f418188",
        "size": 303175,
        "parse_status": "indexed_only",
        "ignored": false,
        "ignored_reason": null
      },
      {
        "source_id": "src_5fa1aebfcb3d4dfb",
        "scope": "input",
        "path": "inputs/指令/知鱼命理AI写作指令.docx",
        "name": "知鱼命理AI写作指令.docx",
        "kind": "instruction_docx",
        "hash": "7dbb5e6ff977ff6eada65235d272513129775b45d2f591028a2029dc88ef8f9b",
        "size": 2530,
        "parse_status": "extractable",
        "ignored": false,
        "ignored_reason": null
      },
      {
        "source_id": "src_c740d50f15ad8ff4",
        "scope": "input",
        "path": "inputs/易学科普/01-五行：世界的五种状态.md",
        "name": "01-五行：世界的五种状态.md",
        "kind": "other",
        "hash": "d535c89fc62f7613f5135c2a74d8dc614b6f19758d99365836fbe17648d47394",
        "size": 9008,
        "parse_status": "discovered",
        "ignored": false,
        "ignored_reason": null
      },
      {
        "source_id": "src_875334fb6373ffa3",
        "scope": "input",
        "path": "inputs/易学科普/02-河图与天干.md",
        "name": "02-河图与天干.md",
        "kind": "other",
        "hash": "df694808679c13f2ec2c6c629979da8a689e3db93a37f51dc1f0d4f4b8567cd5",
        "size": 5512,
        "parse_status": "discovered",
        "ignored": false,
        "ignored_reason": null
      },
      {
        "source_id": "src_5c804cc595b624c2",
        "scope": "input",
        "path": "inputs/易学科普/08-乾坤：为什么是九五之尊.md",
        "name": "08-乾坤：为什么是九五之尊.md",
        "kind": "other",